city,job_title,company,salary,location,experience,education,industry,salary_numeric,edu_code,exp_code
成都,视觉图像算法工程师,鲲鹏智能装备有限公司,1.5-2.5万,成都,3-5年,本科,船舶/航空/航天,20.0,2.0,3.0
成都,设备工程师（视觉）,蜂巢能源科技股份有限公司,1-1.5万·15薪,成都,1-3年,大专,新能源,15.625,1.0,2.0
成都,SYYF2608-图像识别算法工程师(J11719),长园深瑞继保自动化有限公司,1.5-2.5万·13薪,成都,1-3年,硕士,电气/电力/水利,21.666666666666668,3.0,2.0
成都,AI大模型助理研究员,北京大学成都前沿交叉生物技术研究院,1.1-2万,成都,无经验,硕士,制药/生物工程,15.5,3.0,1.0
成都,高级算法工程师,四川丹诺迪科技有限公司,1.5-2.5万·14薪,成都,1-3年,本科,医疗设备/器械,23.333333333333332,2.0,2.0
成都,人工智能培训课程老师,成都网讯创智科技有限公司,1.2-1.8万,成都,1-3年,本科,人工智能,15.0,2.0,2.0
成都,ai研发工程师,成都臻琰科技有限公司,6-9千,成都,1-3年,本科,计算机软件,7.5,2.0,2.0
成都,算法工程师,成都熊谷加世电器有限公司,13-20万/年,成都,1-3年,硕士,机械/设备/重工,13.75,3.0,2.0
成都,算法工程师,四川万益能源科技有限公司,9千-1.5万,成都,无经验,硕士,电气/电力/水利,12.0,3.0,1.0
成都,ai研发工程师,成都臻琰科技有限公司,6-9千,成都,1-3年,本科,计算机软件,7.5,2.0,2.0
成都,算法工程师,电信科学技术第五研究所有限公司,1.5-2万,成都,1-3年,硕士,通信/网络设备,17.5,3.0,2.0
成都,算法工程师,浙江永贵电器股份有限公司,1.5-3万·13薪,成都,3-5年,本科,汽车零部件,24.375,2.0,3.0
成都,算法工程师（通信AI方向）,成都万创科技股份有限公司,2-3.5万,成都,1-3年,硕士,通信/网络设备,27.5,3.0,2.0
成都,ai视觉算法工程师,四川星问数智科技有限公司,1-1.7万,成都,3-5年,本科,机械/设备/重工丨人工智能丨计算机软件,13.5,2.0,3.0
成都,人工智能工程师,民航成都物流技术有限公司,8千-1.2万·15薪,成都,1-3年,硕士,船舶/航空/航天,12.5,3.0,2.0
成都,算法工程师,四川宏华电气有限责任公司,1-1.5万,成都,1-3年,本科,机械/设备/重工,12.5,2.0,2.0
成都,算法工程师,四川天微电子股份有限公司,1.2-2.4万,成都,3-5年,本科,电子/半导体/集成电路丨仪器仪表/工业自动化,18.0,2.0,3.0
成都,AI算法工程师,广东先导稀材股份有限公司,1.5-2.5万·13薪,成都,1-3年,本科,医疗设备/器械,21.666666666666668,2.0,2.0
成都,AI算法工程师,成都海科机械设备制造有限公司,1.5-2.5万,成都,1-3年,本科,机械/设备/重工,20.0,2.0,2.0
成都,算法工程师,成都腾帆计算机科技有限公司,1.5-2.5万,成都,1-3年,硕士,人工智能丨计算机软件丨电子/半导体/集成电路,20.0,3.0,2.0
成都,ai算法工程师,四川金石信安科技有限公司,7-9千,成都,3-5年,本科,计算机软件,8.0,2.0,3.0
成都,ai工程师,成都臻琰科技有限公司,6-8千,成都,无经验,本科,计算机软件,7.0,2.0,1.0
成都,图像算法工程师（三维点云）,成都立德赛科技有限公司,1.5-3万,成都,1-3年,硕士,医疗设备/器械,22.5,3.0,2.0
成都,视觉算法优化研发工程师,成都三是科技有限公司,1-2万,成都,1-3年,硕士,人工智能丨仪器仪表/工业自动化,15.0,3.0,2.0
成都,AI工程师(J10078),康诺亚生物医药科技有限公司,2-2.5万·13薪,成都,3-5年,本科,制药/生物工程,24.375,2.0,3.0
成都,运控算法工程师,中国兵器装备集团自动化研究所有限公司,1.9-3.5万·15薪,成都,1-3年,硕士,人工智能,33.75,3.0,2.0
成都,AI算法工程师,茂炜能源股份有限公司,8千-1.5万,成都,1-3年,大专,新能源,11.5,1.0,2.0
成都,AI算法工程师,成都图迅科技有限公司,1.5-2.5万·13薪,成都,1-3年,本科,通信/网络设备,21.666666666666668,2.0,2.0
成都,AI算法工程师,茂炜能源股份有限公司,8千-1.5万,成都,1-3年,大专,新能源,11.5,1.0,2.0
成都,AI 算法工程师,成都和力九垠科技有限公司,1-2万,成都,1-3年,本科,计算机软件,15.0,2.0,2.0
成都,AI算法工程师,安格利（成都）仪器设备有限公司,1.6-2.4万,成都,1-3年,本科,仪器仪表/工业自动化,20.0,2.0,2.0
成都,AI算法工程师,西南电子技术研究所（中国电子科技集团公司第十研究所）,25-40万/年,成都,1-3年,硕士,电子/半导体/集成电路,27.083333333333332,3.0,2.0
成都,AI算法与数据工程师,乐山中电建生态环保科技有限公司,8千-1.5万,成都,1-3年,本科,环保丨学术/科研,11.5,2.0,2.0
成都,AI算法工程师,广东先导稀材股份有限公司,1.5-2.5万·13薪,成都,1-3年,本科,医疗设备/器械,21.666666666666668,2.0,2.0
成都,自动化设备软件开发(J10524),成都新易盛通信技术股份有限公司,2-4万·14薪,成都,1-3年,硕士,通信/网络设备,35.0,3.0,2.0
成都,ai算法工程师,四川金石信安科技有限公司,7-9千,成都,3-5年,本科,计算机软件,8.0,2.0,3.0
成都,AI算法工程师,成都海科机械设备制造有限公司,1.5-2.5万,成都,1-3年,本科,机械/设备/重工,20.0,2.0,2.0
成都,高级AI算法工程师,成都开方数据科技有限公司,2-3万,成都,3-5年,本科,外包服务丨计算机软件丨网络/信息安全,25.0,2.0,3.0
成都,AI算法初级 理工科优选,成都盈进发网络科技有限公司,7千-1万,成都,1-3年,本科,计算机软件,8.5,2.0,2.0
成都,AI算法工程师,上海光脉医疗科技有限公司,1.5-2.5万·13薪,成都,1-3年,硕士,医疗设备/器械,21.666666666666668,3.0,2.0
成都,人工智能NLP算法工程师,成都熊谷加世电器有限公司,10-20万/年,成都,1-3年,本科,机械/设备/重工,12.5,2.0,2.0
成都,ai算法实习生,成都臻琰科技有限公司,4-6千,成都,无经验,本科,计算机软件,5.0,2.0,1.0
成都,ai研发工程师,成都臻琰科技有限公司,6-9千,成都,1-3年,本科,计算机软件,7.5,2.0,2.0
成都,ai工程师,墨脱兴乾机械设备租赁有限公司,8千-1.6万,成都,1-3年,本科,机械/设备/重工,12.0,2.0,2.0
成都,人工智能开发人员,四川九牛之机械设备有限公司,18-22万/年,成都,1-3年,本科,人工智能丨计算机软件丨机械/设备/重工,16.666666666666668,2.0,2.0
成都,算法工程师（通信AI方向）,成都万创科技股份有限公司,2-3.5万,成都,1-3年,硕士,通信/网络设备,27.5,3.0,2.0
成都,ai视觉算法工程师,四川星问数智科技有限公司,1-1.7万,成都,3-5年,本科,机械/设备/重工丨人工智能丨计算机软件,13.5,2.0,3.0
成都,人工智能大模型工程师/算法工程师,民航第二研究所有限公司,1-1.5万,成都,1-3年,硕士,检测/认证,12.5,3.0,2.0
成都,ai研发工程师,成都臻琰科技有限公司,6-9千,成都,1-3年,本科,计算机软件,7.5,2.0,2.0
成都,人工智能算法工程师,四川凌空天行科技有限公司,2-4万,成都,3-5年,硕士,船舶/航空/航天,30.0,3.0,3.0
成都,ai工程师,墨脱兴乾机械设备租赁有限公司,8千-1.6万,成都,1-3年,本科,机械/设备/重工,12.0,2.0,2.0
成都,AI工程师,康诺亚生物医药科技有限公司,2-3万·14薪,成都,3-5年,本科,制药/生物工程,29.166666666666668,2.0,3.0
成都,AI工程师,民航成都物流技术有限公司,8千-1.2万·15薪,成都,1-3年,硕士,船舶/航空/航天,12.5,3.0,2.0
成都,AI应用开发工程师,四川三思德科技有限公司,1-2万,成都,1-3年,本科,电子技术/半导体/集成电路,15.0,2.0,2.0
成都,人工智能开发人员,四川九牛之机械设备有限公司,18-22万/年,成都,1-3年,本科,人工智能丨计算机软件丨机械/设备/重工,16.666666666666668,2.0,2.0
成都,AI应用工程师,成都德商产投物业服务有限公司,1.2-1.5万,成都,1-3年,硕士,地产经纪/中介,13.5,3.0,2.0
成都,人工智能研发工程师,迈迪陇科技（成都）有限公司,1-2万,成都,1-3年,本科,人工智能丨云计算/大数据丨通信/网络设备,15.0,2.0,2.0
成都,AI工程师(J10078),康诺亚生物医药科技有限公司,2-2.5万·13薪,成都,3-5年,本科,制药/生物工程,24.375,2.0,3.0
成都,ai工程师,成都臻琰科技有限公司,6-8千,成都,无经验,本科,计算机软件,7.0,2.0,1.0
成都,人工智能工程师,民航成都物流技术有限公司,8千-1.2万·15薪,成都,1-3年,硕士,船舶/航空/航天,12.5,3.0,2.0
成都,AI Engineer,友邦资讯科技（广州）有限公司,1.8-2.8万·13薪,成都,1-3年,本科,计算机软件丨计算机服务,24.916666666666668,2.0,2.0
成都,AI工程师,四川鑫投交通科技集团有限公司,1.2-1.5万,成都,3-5年,本科,建筑/建材/工程,13.5,2.0,3.0
成都,AI智能体开发工程师,延长壳牌（四川）石油有限公司,21-33万/年,成都,1-3年,本科,石油/石化,22.5,2.0,2.0
成都,AI智能体开发工程师（中级）,成都数创物联科技有限公司,1.5-2.5万,成都,3-5年,本科,计算机服务,20.0,2.0,3.0
成都,人工智能应用开发工程师,成都华丰工程勘察设计有限公司,1-2万,成都,1-3年,本科,建筑/建材/工程,15.0,2.0,2.0
成都,AI应用开发工程师,四川华西数产科技集团有限公司,15-20万/年,成都,3-5年,本科,电子商务丨计算机软件,14.583333333333334,2.0,3.0
成都,报表工程师(J10488),成都奕成集成电路有限公司,1-1.6万·14薪,成都,1-3年,本科,电子/半导体/集成电路,15.166666666666666,2.0,2.0
成都,大数据开发工程师,兴业数字金融服务（上海）股份有限公司,2-3万,成都,1-3年,硕士,计算机服务丨计算机软件丨企业服务,25.0,3.0,2.0
成都,大数据开发工程师,兴业数字金融服务（上海）股份有限公司,2-3万,成都,1-3年,硕士,计算机服务丨计算机软件丨企业服务,25.0,3.0,2.0
成都,大数据开发工程师,成都民航空管科技发展有限公司,20-30万/年,成都,1-3年,本科,计算机软件,20.833333333333332,2.0,2.0
成都,大数据开发（数据中台交付）,中铝数为（成都）科技有限责任公司,1.5-2.5万,成都,3-5年,本科,人工智能,20.0,2.0,3.0
成都,大数据开发工程师（薪资面议）,成都弓网科技有限责任公司,1-1.5万,成都,3-5年,本科,交通/运输/物流,12.5,2.0,3.0
成都,数字化运营部主管,成都派铂宇航科技发展有限公司,1.5-2.5万,成都,3-5年,本科,船舶/航空/航天,20.0,2.0,3.0
成都,数据开发,高伟达软件股份有限公司,1-1.5万,成都,1-3年,本科,计算机软件,12.5,2.0,2.0
成都,数据库开发工程师,四川九牛之机械设备有限公司,30-35万/年,成都,5-10年,本科,人工智能丨计算机软件丨机械/设备/重工,27.083333333333332,2.0,4.0
成都,高级ETL开发工程师,友邦资讯科技（广州）有限公司,1.5-2.5万,成都,3-5年,本科,计算机软件丨计算机服务,20.0,2.0,3.0
成都,数据开发资深工程师（通威太阳能成都）,通威集团有限公司,1.2-1.9万,成都,3-5年,本科,汽车研发/制造丨新能源丨化工,15.499999999999998,2.0,3.0
成都,大数据工程师,宁波东方理工产业技术研究有限公司,24-30万/年,成都,3-5年,硕士,环保,22.5,3.0,3.0
成都,大数据工程师(J10487),成都奕成集成电路有限公司,1-1.6万·14薪,成都,1-3年,本科,电子/半导体/集成电路,15.166666666666666,2.0,2.0
成都,大数据分析师,四川华西数产科技集团有限公司,15-20万/年,成都,3-5年,本科,电子商务丨计算机软件,14.583333333333334,2.0,3.0
成都,数据工程师（英语流利）,宁波思艾特软件有限公司,1-1.8万,成都,3-5年,本科,计算机软件丨云计算/大数据丨人工智能,14.0,2.0,3.0
成都,数据挖掘工程师,成都博新优创科技有限公司,8千-1.2万,成都,1-3年,本科,计算机服务(系统、数据服务、维修),10.0,2.0,2.0
成都,运维工程师（音乐标签）（微服务+大数据方向）,新讯数字科技（杭州）有限公司,8千-1.2万,成都,1-3年,大专,云计算/大数据丨通信/网络设备丨运营商/增值服务,10.0,1.0,2.0
成都,数据治理（数据中台交付）,中铝数为（成都）科技有限责任公司,1.5-2.5万,成都,3-5年,本科,人工智能,20.0,2.0,3.0
成都,"数据科学经理 (Manager, Data Science)",华侨银行有限公司,1.2-2万,成都,5-10年,本科,银行,16.0,2.0,4.0
成都,信息化应用工程师（AI与数据方向）,中建环能科技股份有限公司,8千-1.5万,成都,1-3年,本科,环保,11.5,2.0,2.0
成都,数据科学副主管,华侨银行有限公司,1.5-2.8万,成都,5-10年,本科,银行,21.5,2.0,4.0
成都,python开发工程师,欧立腾（北京）技术咨询有限公司上海分公司,1.2-1.3万·13薪,成都,1-3年,本科,船舶/航空/航天,13.541666666666666,2.0,2.0
成都,ai开发工程师,四川创企科技有限责任公司,7千-1.2万,成都,1-3年,本科,计算机软件,9.5,2.0,2.0
成都,产品经理（数据中台）,中铝数为（成都）科技有限责任公司,1.7-3.5万,成都,3-5年,本科,人工智能,26.0,2.0,3.0
成都,软件开发工程师（数字业务）,民航成都物流技术有限公司,8千-1.6万,成都,5-10年,大专,船舶/航空/航天,12.0,1.0,4.0
成都,数据分析主任工程师（制造方向）(J14234),中创新航科技集团股份有限公司,1-2万·13薪,成都,1-3年,本科,新能源,16.25,2.0,2.0
成都,Java高级开发工程师（人力资源信息化方向）,成都胜友如云科技有限公司,1.2-1.5万,成都,3-5年,本科,企业服务,13.5,2.0,3.0
成都,"数据科学助理经理 (Assistant Manager, Data Science)",华侨银行有限公司,8千-1.5万,成都,无经验,本科,银行,11.5,2.0,1.0
成都,全栈开发工程师,成都今是科技有限公司,1.9-2.4万·13薪,成都,3-5年,本科,医疗设备/器械,23.291666666666668,2.0,3.0
成都,数据治理工程师（中级）,成都数创物联科技有限公司,1-1.2万,成都,3-5年,本科,计算机服务,11.0,2.0,3.0
成都,软件开发工程师(J14335),中创新航科技集团股份有限公司,1-2万·13薪,成都,1-3年,本科,新能源,16.25,2.0,2.0
成都,数据治理高级工程师,成都数创物联科技有限公司,1.5-2.5万,成都,3-5年,本科,计算机服务,20.0,2.0,3.0
成都,数据工程师,四川供销云科技有限责任公司,15-20万/年,成都,1-3年,本科,新零售丨食品/饮料/粮油丨日化/化妆品,14.583333333333334,2.0,2.0
成都,数据挖掘分析工程师,博睿天下（成都）科技有限责任公司,1.2-1.8万,成都,1-3年,本科,机械/设备/重工,15.0,2.0,2.0
成都,数据库工程师（DBA）(J10534),成都新易盛通信技术股份有限公司,1.5-2.5万·14薪,成都,3-5年,本科,通信/网络设备,23.333333333333332,2.0,3.0
成都,高级Java开发工程师,安世亚太科技股份有限公司,1.5-3万,成都,3-5年,本科,计算机软件丨计算机服务,22.5,2.0,3.0
成都,数据产品经理（自然资源领域）,四川省自然资源数字科技有限责任公司,8千-1.6万,成都,1-3年,硕士,人工智能,12.0,3.0,2.0
成都,数据分析师,中企网络通信技术有限公司,1.4-1.7万,成都,3-5年,本科,计算机服务(系统、数据服务、维修),15.499999999999998,2.0,3.0
武汉,数据分析师,武汉达梦数据库股份有限公司,1-1.5万,武汉,3-5年,本科,云计算/大数据,12.5,2.0,3.0
武汉,资深数据分析师,湖北威马楚通实业集团有限公司,1-1.5万,武汉,3-5年,本科,汽车,12.5,2.0,3.0
武汉,数据分析,东风汽车集团股份有限公司,1.5-2.5万,武汉,1-3年,本科,汽车研发/制造,20.0,2.0,2.0
武汉,区域数据分析-奕境,东风汽车集团股份有限公司,1-1.5万,武汉,1-3年,本科,汽车研发/制造,12.5,2.0,2.0
武汉,数据分析专员,武汉英之略科技有限公司,8千-1万,武汉,1-3年,本科,计算机软件,9.0,2.0,2.0
武汉,数据分析工程师,武汉康普常青软件技术股份有限公司,8千-1.3万,武汉,1-3年,硕士,电气/电力/水利,10.5,3.0,2.0
武汉,数据分析建模岗,泰康在线财产保险股份有限公司,1.3-2万·14薪,武汉,1-3年,本科,保险,19.25,2.0,2.0
武汉,高级数据分析师,武汉良之隆食材股份有限公司,1.5-2万,武汉,3-5年,本科,食品/饮料/粮油,17.5,2.0,3.0
武汉,数据分析专员,徐州星享网络科技有限公司,4-5.5千,武汉,1-3年,本科,人力资源服务,4.75,2.0,2.0
武汉,财务共享中心-数据分析岗（央企）,华润置地（武汉）数据咨询服务有限公司,1-1.5万·15薪,武汉,1-3年,本科,人力资源服务丨财务/审计/税务,15.625,2.0,2.0
武汉,Python智能体开发工程师,武汉丽合智造生物科技有限公司,6千-1万,武汉,1-3年,本科,制药/生物工程,8.0,2.0,2.0
武汉,AI前线部署工程师（FDE）,湖北连邦云创科技有限公司,8千-1.5万,武汉,1-3年,本科,企业服务,11.5,2.0,2.0
武汉,T3-金融代码评测,武汉热热数据科技有限公司,6-8千,武汉,1-3年,本科,人工智能,7.0,2.0,2.0
武汉,Python开发工程师,武汉戎信科技有限责任公司,5千-1万,武汉,1-3年,大专,计算机软件,7.5,1.0,2.0
武汉,XMC-Agent开发主任工程师,武汉新芯集成电路股份有限公司,2-4万·15薪,武汉,1-3年,本科,电子/半导体/集成电路,37.5,2.0,2.0
武汉,高级应用开发工程师,武汉颐思谱科技有限公司,2.5-3.5万·14薪,武汉,1-3年,硕士,电子/半导体/集成电路,35.0,3.0,2.0
武汉,数据分析师,湖北全宇能源有限公司,1-1.5万,武汉,1-3年,大专,计算机软件,12.5,1.0,2.0
武汉,数据分析师,九州通医药集团股份有限公司,7-9千·13薪,武汉,1-3年,本科,制药/生物工程,8.666666666666666,2.0,2.0
武汉,数据分析岗,九州通医药集团股份有限公司,9千-1.2万,武汉,1-3年,本科,制药/生物工程,10.5,2.0,2.0
武汉,AI应用开发工程师（Python/RPA/大模型方向）,湖北三丰智能装备有限公司,1.2-1.8万·13薪,武汉,1-3年,本科,机械/设备/重工,16.25,2.0,2.0
武汉,数产集团AI产品经理(J14699),湖北省数字产业发展集团有限公司,15-25万/年,武汉,1-3年,本科,云计算/大数据丨网络/信息安全丨计算机服务,16.666666666666668,2.0,2.0
武汉,数产集团算法研究岗(J14700),湖北省数字产业发展集团有限公司,15-25万/年,武汉,1-3年,本科,云计算/大数据丨网络/信息安全丨计算机服务,16.666666666666668,2.0,2.0
武汉,高级软件工程师（python开发）,罗辑技术（武汉）有限公司,6-11.5万/年,武汉,无经验,本科,制药/生物工程丨医疗设备/器械丨仪器仪表/工业自动化,7.291666666666667,2.0,1.0
武汉,高级分析师,武汉光谷创投私募基金管理有限公司,6千-1.2万,武汉,无经验,本科,基金,9.0,2.0,1.0
武汉,S电力交易统计分析专责,武汉大华红亚科技有限公司,7-8千,武汉,1-3年,本科,仪器仪表/工业自动化,7.5,2.0,2.0
武汉,信息科技部数据管理岗,宏泰新航金融租赁有限公司,1.2-2万,武汉,1-3年,本科,投资/融资,16.0,2.0,2.0
武汉,数据策略工程师,东风汽车集团股份有限公司,1.5-2.5万,武汉,1-3年,本科,汽车研发/制造,20.0,2.0,2.0
武汉,数据部主管,湖北恒安芙林药业股份有限公司,1-1.5万·13薪,武汉,1-3年,本科,制药/生物工程,13.541666666666666,2.0,2.0
武汉,数据安全工程师,赫盾数（上海）信息科技有限公司,1.2-1.8万,武汉,1-3年,本科,网络/信息安全丨企业服务丨计算机软件,15.0,2.0,2.0
武汉,数据开发工程师,武汉钧维电子信息有限公司,1-1.6万·13薪,武汉,1-3年,本科,计算机软件,14.083333333333334,2.0,2.0
武汉,数据管理专员,武汉创力数码软件科技有限公司,6.5-8千,武汉,1-3年,大专,计算机软件,7.25,1.0,2.0
武汉,财务分析数据专家,远大医药（中国）有限公司,1.5-2万·15薪,武汉,3-5年,硕士,制药/生物工程,21.875,3.0,3.0
武汉,智驾大数据挖掘-奕派科技,东风汽车集团股份有限公司,1.5-2.5万,武汉,1-3年,本科,汽车研发/制造,20.0,2.0,2.0
武汉,大数据开发工程师,武汉英之略科技有限公司,9千-1.2万·13薪,武汉,1-3年,本科,计算机软件,11.375,2.0,2.0
武汉,高级中心化数据监察员,上海世和弘翼医学临床研究有限公司,1.2-1.8万,武汉,1-3年,本科,制药/生物工程丨医疗/护理/卫生丨财务/审计/税务,15.0,2.0,2.0
武汉,统计编程主管-临床（武汉）,上海盛迪医药有限公司,2-2.5万,武汉,3-5年,本科,制药/生物工程,22.5,2.0,3.0
武汉,大数据开发工程师,东风卓联汽车服务有限公司数智科技分公司,1.5-2.5万,武汉,1-3年,本科,计算机软件,20.0,2.0,2.0
武汉,信息化数据工程师 (MJ000285),武汉光安伦光电技术有限公司,1.5-3万·13薪,武汉,1-3年,本科,电子/半导体/集成电路,24.375,2.0,2.0
武汉,市场分析师,成都众鑫达人力资源有限公司,1.3-1.4万·13薪,武汉,无经验,大专,人工智能丨网络/信息安全,14.625,1.0,1.0
武汉,退役光伏板回收研发工程师,武汉天源集团股份有限公司,1.2-2万,武汉,1-3年,硕士,新能源,16.0,3.0,2.0
武汉,Java大数据工程师（五险一金),奥博尔工程技术（上海）有限公司,1-1.8万,武汉,1-3年,本科,电气/电力/水利,14.0,2.0,2.0
武汉,Java大数据工程师（五险一金),景元天泽智能科技（湖北）有限公司,1-1.6万,武汉,1-3年,本科,网络/信息安全丨计算机服务丨计算机软件,13.0,2.0,2.0
武汉,信息化数据工程师 (MJ000285),武汉光安伦光电技术有限公司,1.5-3万·13薪,武汉,1-3年,本科,电子/半导体/集成电路,24.375,2.0,2.0
武汉,抗体研发工程师,武汉生之源生物科技股份有限公司,8千-1.3万,武汉,1-3年,硕士,制药/生物工程,10.5,3.0,2.0
武汉,软件开发工程师,武汉电擎未来科技有限公司,1.8-2.4万·13薪,武汉,1-3年,本科,计算机服务,22.75,2.0,2.0
武汉,IT,广东红海联动信息科技有限公司,9千-1.2万·13薪,武汉,1-3年,大专,汽车零部件丨汽车研发/制造丨机械/设备/重工,11.375,1.0,2.0
武汉,智能制造开发工程师(J18603),武汉迈瑞科技有限公司,1.3-2.3万·15薪,武汉,3-5年,本科,医疗设备/器械,22.5,2.0,3.0
武汉,IE工程师（成本）,深圳宝龙达信息技术股份有限公司,8千-1.6万·14薪,武汉,1-3年,本科,消费电子产品丨电子/半导体/集成电路,14.0,2.0,2.0
武汉,数据开发工程师-武汉,京北方信息技术股份有限公司,1-1.3万,武汉,1-3年,本科,银行丨计算机软件,11.5,2.0,2.0
武汉,数据开发工程师,深圳市南电云商有限公司,9千-1.8万,武汉,3-5年,大专,计算机软件丨人工智能丨计算机服务,13.5,1.0,3.0
武汉,数据开发工程师,武汉钧维电子信息有限公司,1-1.6万·13薪,武汉,1-3年,本科,计算机软件,14.083333333333334,2.0,2.0
武汉,测绘内业数据工程师,武汉华中国土科技有限公司,4-8千,武汉,无经验,大专,计算机服务,6.0,1.0,1.0
武汉,资深上位机工程师,江苏芯长征微电子集团股份有限公司,2-3.5万·14薪,武汉,3-5年,本科,电子/半导体/集成电路,32.083333333333336,2.0,3.0
武汉,测试工程师,武汉电擎未来科技有限公司,1.3-1.6万·13薪,武汉,1-3年,本科,计算机服务,15.708333333333336,2.0,2.0
武汉,桌面运维工程师,南京北清智能科技有限公司,7.5-9.5千,武汉,1-3年,大专,机械/设备/重工,8.5,1.0,2.0
武汉,材料研发工程师,华曦未来新材料（武汉）有限公司,1.2-1.8万,武汉,3-5年,硕士,电子/半导体/集成电路,15.0,3.0,3.0
武汉,质量管理体系工程师,宁波芯丰精密科技有限公司,8千-1万·13薪,武汉,1-3年,本科,机械/设备/重工丨电子/半导体/集成电路丨仪器仪表/工业自动化,9.75,2.0,2.0
武汉,质量体系工程师,宁波芯丰精密科技有限公司,8千-1.2万,武汉,1-3年,本科,机械/设备/重工丨电子/半导体/集成电路丨仪器仪表/工业自动化,10.0,2.0,2.0
武汉,电气工程师,武汉电擎未来科技有限公司,1.4-1.6万·13薪,武汉,1-3年,本科,计算机服务,16.25,2.0,2.0
武汉,质量体系工程师,宁波芯丰精密科技有限公司,8千-1.2万,武汉,1-3年,本科,机械/设备/重工丨电子/半导体/集成电路丨仪器仪表/工业自动化,10.0,2.0,2.0
武汉,光学工程师,武汉市莫雷光电科技有限公司,1-1.5万,武汉,1-3年,本科,电子/半导体/集成电路,12.5,2.0,2.0
武汉,资深电气工程师,江苏芯长征微电子集团股份有限公司,2.5-3.5万·15薪,武汉,3-5年,硕士,电子/半导体/集成电路,37.5,3.0,3.0
武汉,硬件工程师,武汉电擎未来科技有限公司,1.8-2.4万·13薪,武汉,1-3年,本科,计算机服务,22.75,2.0,2.0
武汉,XMC-硅光器件主任工程师（D）(J11442),武汉新芯集成电路股份有限公司,2-3.5万·15薪,武汉,3-5年,硕士,电子/半导体/集成电路,34.375,3.0,3.0
武汉,研发项目工程师,宁波芯丰精密科技有限公司,1-1.5万·13薪,武汉,1-3年,本科,机械/设备/重工丨电子/半导体/集成电路丨仪器仪表/工业自动化,13.541666666666666,2.0,2.0
武汉,骨架试验工程师 （江夏何家湖工业园）,武汉中人瑞众汽车零部件产业有限公司,1-1.2万·13薪,武汉,1-3年,大专,汽车研发/制造丨汽车零部件,11.916666666666666,1.0,2.0
武汉,质量工程师,武汉钧达汽车饰件有限公司,6-7.5千,武汉,1-3年,本科,汽车零配件,6.75,2.0,2.0
武汉,TGV研发工程师,武汉瑞森联科技有限公司,1.5-2万·14薪,武汉,1-3年,本科,仪器仪表/工业自动化丨机械/设备/重工,20.416666666666668,2.0,2.0
