city,job_title,company,salary,location,experience,education,industry,salary_numeric,edu_code,exp_code
深圳,AI算法工程师,深圳市力胜源科技有限公司,2.5-4万·15薪,深圳,1-3年,硕士,新能源,40.625,3.0,2.0
深圳,AI算法工程师 (MJ000266),深圳市维海德技术股份有限公司,2-3.5万,深圳,3-5年,硕士,电子/半导体/集成电路,27.5,3.0,3.0
深圳,AI算法工程师,深圳市恒运昌真空技术股份有限公司,2-2.5万·13薪,深圳,3-5年,本科,电子/半导体/集成电路,24.375,2.0,3.0
深圳,传统图像算法,光子（深圳）精密科技有限公司,1.5-2.5万,深圳,1-3年,本科,仪器仪表/工业自动化,20.0,2.0,2.0
深圳,软件算法工程师—生物识别方向,法雷奥汽车内部控制（深圳）有限公司,1.5-3万·14薪,深圳,1-3年,本科,汽车零部件,26.25,2.0,2.0
深圳,算法工程师,深圳市正运动技术有限公司,2-4万·13薪,深圳,1-3年,硕士,电子/半导体/集成电路,32.5,3.0,2.0
深圳,视频AI算法训练工程师,深圳高新区信息网有限公司,1.2-1.7万,深圳,1-3年,本科,通信/电信/网络设备,14.5,2.0,2.0
深圳,AI算法工程师/双休/无人机项目,深圳市武测空间信息有限公司,2-3万,深圳,3-5年,本科,人工智能,25.0,2.0,3.0
深圳,高级AI算法工程师,深圳银星智能集团股份有限公司,2.5-5万,深圳,3-5年,硕士,消费电子产品,37.5,3.0,3.0
深圳,AI算法工程师,深圳市泰科思特精密工业有限公司,3-4万,深圳,1-3年,博士,机械/设备/重工,35.0,4.0,2.0
深圳,AI算法工程师,深圳市辉熙智能科技有限公司,1-2万,深圳,1-3年,本科,仪器仪表/工业自动化,15.0,2.0,2.0
深圳,AI算法助理工程师,深圳市资福医疗技术有限公司,2-3.5万,深圳,1-3年,硕士,医疗设备/器械,27.5,3.0,2.0
深圳,AI算法工程师,深圳市三平影像科技有限公司,8千-1.5万,深圳,1-3年,本科,医疗设备/器械,11.5,2.0,2.0
深圳,AI算法负责人,前锦网络信息技术（上海）有限公司,2.5-3.5万,深圳,3-5年,本科,人力资源服务,30.0,2.0,3.0
深圳,AI算法工程师,深圳市力胜源科技有限公司,2.5-5万·13薪,深圳,1-3年,硕士,新能源,40.625,3.0,2.0
深圳,AI算法工程师,深圳柏垠生物科技有限公司,2.5-4.5万·14薪,深圳,5-10年,本科,制药/生物工程丨医疗设备/器械,40.833333333333336,2.0,4.0
深圳,AI算法工程师,深圳市金流明光电技术有限公司,2.5-4.5万,深圳,1-3年,本科,电子技术/半导体/集成电路,35.0,2.0,2.0
深圳,高级AI算法工程师,深圳银星智能集团股份有限公司,2.5-5万,深圳,1-3年,硕士,消费电子产品,37.5,3.0,2.0
深圳,AI算法/算法软件工程师,云南尧然晟电力有限责任公司,1-2万,深圳,1-3年,本科,电气/电力/水利丨新能源,15.0,2.0,2.0
深圳,AI算法工程师,深圳市晟瑞科技有限公司,1.5-2.5万,深圳,1-3年,本科,通信/网络设备丨电子/半导体/集成电路,20.0,2.0,2.0
深圳,高级AI算法工程师,深圳市英威腾电气股份有限公司,3-4万·14薪,深圳,5-10年,硕士,仪器仪表/工业自动化,40.833333333333336,3.0,4.0
深圳,大数据开发,稳健医疗用品股份有限公司,1.5-2万,深圳,1-3年,本科,医疗/护理/卫生丨医疗设备/器械,17.5,2.0,2.0
深圳,大数据开发工程师,深圳市丰宜科技集团股份有限公司,1.5-2.5万,深圳,1-3年,本科,在线生活服务(O2O)丨新零售,20.0,2.0,2.0
深圳,大数据开发工程师,深圳市丰宜科技集团股份有限公司,2-3万,深圳,1-3年,本科,在线生活服务(O2O)丨新零售,25.0,2.0,2.0
深圳,大数据开发工程师,深圳市讯美智联电子有限公司,1.5-2.5万·13薪,深圳,1-3年,本科,通信/网络设备,21.666666666666668,2.0,2.0
深圳,大数据开发工程师,可可（深圳）媒体技术有限公司,1.5-2.5万,深圳,1-3年,本科,广告,20.0,2.0,2.0
深圳,大数据开发高级工程师-集团总部(J20501),欣旺达电子股份有限公司,1.8-2.8万·13薪,深圳,1-3年,本科,消费电子产品,24.916666666666668,2.0,2.0
深圳,大数据开发工程师,深圳市进汇科技有限公司,2-3万,深圳,1-3年,本科,计算机软件,25.0,2.0,2.0
深圳,大数据开发主任工程师,惠州市豪鹏科技有限公司,3-4万,深圳,1-3年,本科,新能源,35.0,2.0,2.0
深圳,大数据开发工程师,广州碧软信息科技有限公司,1.1-1.6万,深圳,1-3年,本科,计算机软件,13.5,2.0,2.0
深圳,大数据开发,中数通信息有限公司,1.1-1.5万,深圳,3-5年,本科,计算机软件,13.0,2.0,3.0
深圳,高级大数据开发工程师（平台 / DataOps 方向）,国投证券股份有限公司,1.5-2.5万·16薪,深圳,1-3年,本科,证券/期货,26.666666666666668,2.0,2.0
深圳,大数据开发工程师,武汉佰钧成技术有限责任公司,1-1.5万,深圳,1-3年,大专,计算机软件,12.5,1.0,2.0
深圳,大数据开发工程师（保险系统）,上海复深蓝软件股份有限公司,1.4-1.8万,深圳,5-10年,本科,计算机软件,16.0,2.0,4.0
深圳,数据开发工程师,深圳鹏智瑞数字营销有限公司,1.5-2.5万·13薪,深圳,3-5年,本科,计算机软件,21.666666666666668,2.0,3.0
深圳,国企-大数据开发工程师,前锦网络信息技术（上海）有限公司,2-3.5万,深圳,1-3年,硕士,人力资源服务,27.5,3.0,2.0
深圳,数据开发（深圳）,北京南天信息工程有限公司,1-1.9万,深圳,3-5年,本科,其他行业,14.5,2.0,3.0
深圳,大数据开发工程师,广州光喻原力软件有限公司,1-1.5万,深圳,无经验,本科,计算机服务丨计算机软件丨网络/信息安全,12.5,2.0,1.0
深圳,AI 大数据中台工程师(J10699),深圳麦科田生物医疗技术股份有限公司,2-4万,深圳,1-3年,本科,医疗设备/器械,30.0,2.0,2.0
深圳,数仓开发,深圳市法本信息技术股份有限公司,1.6-1.9万,深圳,3-5年,本科,计算机软件,17.5,2.0,3.0
深圳,数据仓库(中级/高级)工程师-集团总部(J20500),欣旺达电子股份有限公司,1.8-2.6万·13薪,深圳,3-5年,本科,消费电子产品,23.833333333333332,2.0,3.0
深圳,"Analyst, SAP",基品（上海）贸易有限公司,2.5-3万·13薪,深圳,3-5年,本科,贸易/进出口,29.791666666666668,2.0,3.0
深圳,数据开发工程师,中数通信息有限公司,1.5-2.5万,深圳,1-3年,本科,计算机软件,20.0,2.0,2.0
深圳,数据开发工程师（无人科技）,前锦网络信息技术（上海）有限公司,2.5-3.5万·13薪,深圳,5-10年,本科,人力资源服务,32.5,2.0,4.0
深圳,金融科技委员会-国际业务数据开发工程师(J10038),中信期货有限公司,1.5-3万,深圳,1-3年,本科,证券/期货,22.5,2.0,2.0
深圳,高级数据开发工程师JD,广州智唯易才企业管理顾问有限公司,1-2万,深圳,5-10年,本科,运营商/增值服务,15.0,2.0,4.0
深圳,0291J5-高级数据开发工程师,中国平安人寿保险股份有限公司,1-1.5万,深圳,3-5年,本科,保险,12.5,2.0,3.0
深圳,智慧医疗数据开发工程师,广州智唯易才企业管理顾问有限公司,1-2万,深圳,5-10年,本科,运营商/增值服务,15.0,2.0,4.0
深圳,大数据平台运维工程师,中数通信息有限公司,1.2-1.8万,深圳,3-5年,本科,计算机软件,15.0,2.0,3.0
深圳,大数据运维（深圳）,广东阿尔创通信技术股份有限公司,1.3-1.7万,深圳,1-3年,本科,网络/信息安全,15.0,2.0,2.0
深圳,大数据分析工程师,深圳市旭光智信息科技有限公司,6-9千,深圳,无经验,本科,计算机软件,7.5,2.0,1.0
深圳,AI数据工程师,深圳市格瑞普电池有限公司,1.1-1.8万,深圳,1-3年,本科,新能源,14.500000000000002,2.0,2.0
深圳,SSD销售工程师,深圳市正品之源电子有限公司,1-1.2万,深圳,1-3年,大专,电子/半导体/集成电路,11.0,1.0,2.0
深圳,具身智能数据平台研发工程师,安世腾科技（深圳）有限公司,2-3万·15薪,深圳,3-5年,硕士,云计算/大数据,31.25,3.0,3.0
深圳,数据挖掘工程师,广州光喻原力软件有限公司,9千-1.2万,深圳,无经验,本科,计算机服务丨计算机软件丨网络/信息安全,10.5,2.0,1.0
深圳,.NET开发工程师（数据平台开发方向）,精达科技研发（深圳）有限公司,1.2-2万,深圳,1-3年,本科,电子/半导体/集成电路,16.0,2.0,2.0
深圳,数据产品工程师（制造业方向）,深圳市兆驰股份有限公司,1.5-2.5万·13薪,深圳,1-3年,本科,电子/半导体/集成电路丨通信/网络设备,21.666666666666668,2.0,2.0
深圳,数仓架构(J12493),深圳市英威腾电气股份有限公司,2-3万·14薪,深圳,5-10年,本科,仪器仪表/工业自动化,29.166666666666668,2.0,4.0
杭州,基金数据分析师（财富管理方向）,南京贝塔大数据科技有限公司,8千-1.2万,南京,1-3年,本科,计算机软件,10.0,2.0,2.0
杭州,AI数据分析师（网络安全方向）,江苏省未来网络创新研究院,1-2万,南京,1-3年,本科,通信/电信/网络设备,15.0,2.0,2.0
杭州,数据分析师,江苏盛羽达生物科技有限公司,5千-1万·13薪,南京,无经验,大专,制药/生物工程,8.125,1.0,1.0
杭州,AI数据分析工程师,南京至盛为康科技有限公司,2-3.2万,南京,1-3年,硕士,制药/生物工程,26.0,3.0,2.0
杭州,电池大数据分析及算法模型开发工程师(J10291),爱尔集新能源（中国）有限公司,2-4万·14薪,南京,3-5年,硕士,新能源,35.0,3.0,3.0
杭州,python开发工程师,南京拾柴信息科技有限公司,1-1.5万,南京,1-3年,本科,计算机软件,12.5,2.0,2.0
杭州,电芯体系大数据分析,爱尔集新能源（中国）有限公司,1.5-3万·14薪,南京,3年,硕士,新能源,26.25,3.0,1.0
杭州,Python中高级工程师,南京创联智软信息科技有限公司,8千-1.3万,南京,1-3年,本科,计算机软件,10.5,2.0,2.0
杭州,python测试开发,中博信息技术研究院有限公司,1.1-1.8万,南京,1-3年,本科,计算机软件,14.500000000000002,2.0,2.0
杭州,Python中高级工程师,南京创联智软信息科技有限公司,8千-1.5万,南京,1-3年,本科,计算机软件,11.5,2.0,2.0
杭州,AI应用技术工程师（智能营销方向）,江苏艾津作物科技集团有限公司,1.4-1.7万,南京,1-3年,本科,化工,15.499999999999998,2.0,2.0
杭州,Python开发工程师（石化行业机械设备故障诊断）,江苏迪肯工业科技股份有限公司,1.2-2.4万,南京,3-5年,本科,仪器仪表/工业自动化,18.0,2.0,3.0
杭州,数据分析智能体开发专家 - 需要有产品经验,江苏紫鲸人工智能技术研发有限公司,3-3.5万,南京,3-5年,本科,计算机软件,32.5,2.0,3.0
杭州,生信工程师,江苏先声诊断技术有限公司,2-3万,南京,无经验,硕士,制药/生物工程,25.0,3.0,1.0
杭州,机器人测试工程师,南京日冲软件股份有限公司,1.1-1.5万,南京,1-3年,本科,计算机软件,13.0,2.0,2.0
杭州,数据飞轮工程师,南京蔚蓝智能科技有限公司,2-4万,南京,无经验,本科,人工智能丨计算机软件丨计算机硬件,30.0,2.0,1.0
杭州,数值预报工程师,南京大桥机器有限公司,1-1.8万,南京,5-10年,硕士,通信/网络设备,14.0,3.0,4.0
杭州,电力交易数据工程师,江苏林洋能源股份有限公司,1-2万,南京,无经验,硕士,新能源,15.0,3.0,1.0
杭州,数据算法工程师,中科工业人工智能研究院,2-3万·14薪,南京,1-3年,硕士,人工智能,29.166666666666668,3.0,2.0
杭州,大数据工程师,江苏益能智慧科技有限公司,8千-1.5万,南京,1-3年,本科,学术/科研,11.5,2.0,2.0
杭州,临床统计编程工程师(J15836),正大天晴药业集团股份有限公司,1.5-2.5万,南京,3-5年,本科,制药/生物工程,20.0,2.0,3.0
杭州,数据开发岗 （大型央企）,前锦网络信息技术（上海）有限公司,20-35万/年,南京,1-3年,硕士,人力资源服务,22.916666666666668,3.0,2.0
杭州,数据运维,成都众鑫达人力资源有限公司,1.2-1.3万·13薪,南京,无经验,大专,人工智能丨网络/信息安全,13.541666666666666,1.0,1.0
杭州,数据算法工程师,中科工业人工智能研究院,2-3万·14薪,南京,1-3年,硕士,人工智能,29.166666666666668,3.0,2.0
杭州,市场分析师,成都众鑫达人力资源有限公司,1.3-1.4万·13薪,南京,无经验,大专,人工智能丨网络/信息安全,14.625,1.0,1.0
杭州,高级ai算法工程师(工业大数据),朗坤智慧科技股份有限公司,2.5-4万,南京,无经验,博士,计算机软件,32.5,4.0,1.0
杭州,雷达算法工程师--数据处理,南京楚航科技股份有限公司,20-35万/年,南京,5-10年,硕士,汽车零部件,22.916666666666668,3.0,4.0
杭州,AI训练及信号分析工程师,扬州晶明科技有限公司,2-3万·13薪,南京,1-3年,本科,仪器仪表/工业自动化,27.083333333333332,2.0,2.0
杭州,AI应用工程师,江苏高捷节能装备集团有限公司,1-1.5万·13薪,南京,3-5年,本科,化工丨环保,13.541666666666666,2.0,3.0
杭州,舆情分析师,南京日报文化产业发展有限公司,6-8千,南京,1-3年,本科,文化艺术/娱乐,7.0,2.0,2.0
杭州,数据治理工程师,江苏康缘阳光药业有限公司,8千-1.5万,南京,1-3年,本科,计算机软件丨人工智能,11.5,2.0,2.0
杭州,大模型训练工程师,南京蔚蓝智能科技有限公司,2-4万,南京,无经验,本科,人工智能丨计算机软件丨计算机硬件,30.0,2.0,1.0
杭州,AI数据分析专员,江苏今世缘酒业股份有限公司,20-30万/年,南京,1-3年,硕士,快速消费品(食品、饮料、化妆品),20.833333333333332,3.0,2.0
杭州,数据要素解决方案工程师,江苏基久网络科技有限公司南京分公司,7千-1万,南京,3-5年,大专,通信/网络设备丨计算机服务丨网络/信息安全,8.5,1.0,3.0
杭州,主站分析,江苏数能电力技术有限公司,1-1.1万,南京,1-3年,本科,仪器仪表/工业自动化,10.5,2.0,2.0
杭州,资深JAVA开发工程师,南京国睿信维软件有限公司,1.6-2万,南京,5-10年,本科,计算机软件丨计算机硬件丨计算机服务,18.0,2.0,4.0
杭州,机器人测试工程师,南京日冲软件股份有限公司,1.1-1.5万,南京,1-3年,本科,计算机软件,13.0,2.0,2.0
杭州,大数据工程师,江苏益能智慧科技有限公司,8千-1.5万,南京,1-3年,本科,学术/科研,11.5,2.0,2.0
杭州,电力交易数据工程师,江苏林洋能源股份有限公司,1-2万,南京,无经验,硕士,新能源,15.0,3.0,1.0
杭州,运营工程师,广州天诚伟业通信科技有限公司,8.7千-1万,南京,3-5年,大专,通信/电信/网络设备,9.35,1.0,3.0
杭州,MES开发工程师(000377),南京镭芯光电有限公司,8千-1.5万,南京,1-3年,本科,电子/半导体/集成电路,11.5,2.0,2.0
杭州,软硬件系统交付工程师,江苏普为科技有限公司,8千-1万,南京,1-3年,本科,仪器仪表/工业自动化,9.0,2.0,2.0
杭州,空调压缩机性能开发工程师,南京乐金熊猫电器有限公司,2-3万·14薪,南京,1-3年,本科,家居/家具/家电,29.166666666666668,2.0,2.0
杭州,研发质量工程师,南京高华科技股份有限公司,9千-1.2万,南京,3-5年,本科,仪器仪表/工业自动化,10.5,2.0,3.0
杭州,网络运维工程师,江苏安华数码科技有限公司,8千-1.2万,南京,1-3年,大专,计算机服务丨电子/半导体/集成电路丨通信/网络设备,10.0,1.0,2.0
杭州,网络运维工程师,广州天诚伟业通信科技有限公司,7.7-9.7千,南京,3-5年,大专,通信/电信/网络设备,8.7,1.0,3.0
杭州,CF工程师,江苏精煜智显科技有限公司,8千-1.5万,南京,3-5年,本科,电子/半导体/集成电路,11.5,2.0,3.0
杭州,负载网络工程师,广州天诚伟业通信科技有限公司,9.7千-1.1万,南京,1-3年,大专,通信/电信/网络设备,10.35,1.0,2.0
杭州,IT经理,无锡诺宇医药科技有限公司,1.5-2万,南京,3-5年,本科,医疗设备/器械,17.5,2.0,3.0
杭州,网络监控工程师,广州天诚伟业通信科技有限公司,4.8-5.8千,南京,1-3年,大专,通信/电信/网络设备,5.3,1.0,2.0
杭州,电气自动化工程师,武汉职猎企业管理咨询有限公司,1.5-2.5万·14薪,南京,1-3年,本科,汽车研发/制造丨仪器仪表/工业自动化丨船舶/航空/航天,23.333333333333332,2.0,2.0
杭州,IT Security Expert(A18776),宝马诚迈信息技术有限公司,1.5-2.5万,南京,5-10年,本科,计算机服务,20.0,2.0,4.0
杭州,工艺工程师(J10102),南京茂莱光学科技股份有限公司,8千-1.5万,南京,3年,本科,仪器仪表/工业自动化,11.5,2.0,1.0
杭州,网络工程师,艾德美育（北京）教育科技有限公司,8千-1万,南京,无经验,,培训机构,9.0,2.0,1.0
杭州,AOI工程师,南京伟测半导体科技有限公司,1-1.3万·13薪,南京,1-3年,本科,电子/半导体/集成电路,12.458333333333334,2.0,2.0
杭州,注塑技术员/班长,南京嘉美服饰辅料有限公司,7千-1.3万,南京,1-3年,大专,服装丨印刷/包装/造纸,10.0,1.0,2.0
杭州,桌面运维工程师,南京北清智能科技有限公司,7.5-9.5千,南京,1-3年,大专,机械/设备/重工,8.5,1.0,2.0
杭州,信息安全管控主管/经理,江苏康缘阳光药业有限公司,1-1.5万,南京,1-3年,本科,计算机软件丨人工智能,12.5,2.0,2.0
杭州,机械产品工程师,南京美盛电气仪表工程有限公司,7-9千,南京,3-5年,本科,机械/设备/重工丨仪器仪表/工业自动化,8.0,2.0,3.0
杭州,数据要素解决方案工程师,中通服咨询设计研究院有限公司,1.5-2万,南京,1-3年,本科,通信/网络设备丨计算机服务丨运营商/增值服务,17.5,2.0,2.0
杭州,数据算法工程师,中科工业人工智能研究院,2-3万·14薪,南京,1-3年,硕士,人工智能,29.166666666666668,3.0,2.0
杭州,数据飞轮工程师,南京蔚蓝智能科技有限公司,2-4万,南京,无经验,本科,人工智能丨计算机软件丨计算机硬件,30.0,2.0,1.0
杭州,数据治理工程师,华新（中国）投资有限公司,1.2-2.2万·15薪,南京,3-5年,本科,其他行业,21.25,2.0,3.0
杭州,数据治理工程师,江苏康缘阳光药业有限公司,8千-1.5万,南京,1-3年,本科,计算机软件丨人工智能,11.5,2.0,2.0
杭州,数据处理工程师,南京国睿防务系统有限公司,1.7-2.5万,南京,无经验,硕士,通信/网络设备丨电子/半导体/集成电路丨船舶/航空/航天,21.0,3.0,1.0
杭州,数值预报工程师,南京大桥机器有限公司,1-1.8万,南京,5-10年,硕士,通信/网络设备,14.0,3.0,4.0
杭州,数据开发工程师,南京六朝云智科技有限公司,1.3-1.5万,南京,3-5年,本科,计算机软件,14.0,2.0,3.0
杭州,数据开发工程师,南京药石科技股份有限公司,1.5-3万,南京,1-3年,本科,制药/生物工程,22.5,2.0,2.0
杭州,数智化工程师,中车城市交通规划设计研究院有限公司,1.5-2.9万,南京,1-3年,本科,工程施工,22.0,2.0,2.0
杭州,数据要素解决方案工程师,江苏基久网络科技有限公司南京分公司,7千-1万,南京,3-5年,大专,通信/网络设备丨计算机服务丨网络/信息安全,8.5,1.0,3.0
杭州,电池大数据分析及算法模型开发工程师(J10291),爱尔集新能源（中国）有限公司,2-4万·14薪,南京,3-5年,硕士,新能源,35.0,3.0,3.0
杭州,主任工程师（后端工程师（AI云服务））(J30654),奇瑞汽车股份有限公司,1.5-3万,南京,5-10年,本科,汽车研发/制造丨汽车零部件,22.5,2.0,4.0
杭州,声学算法工程师,立讯精密工业股份有限公司,1.8-3万·13薪,南京,1-3年,硕士,消费电子产品,26.0,3.0,2.0
杭州,实施工程师-数据治理方向(J12334),北京三维天地科技股份有限公司济南分公司,6-9千,南京,3-5年,本科,计算机软件,7.5,2.0,3.0
杭州,AI工程师（无损检测数据诊断）,广州欧美大地仪器科技有限公司,1-1.5万,南京,1-3年,本科,建筑工程检测丨批发/零售丨贸易/进出口,12.5,2.0,2.0
杭州,机器学习工程师（物理仿真）(J10037),上海索辰信息科技股份有限公司,2.5-3.5万,南京,无经验,博士,人工智能,30.0,4.0,1.0
杭州,软件开发工程师(机器学习/智能设备),凯易讯网络技术开发（南京）有限公司,1.7-2.9万·13薪,南京,3-5年,本科,通信/网络设备,24.916666666666668,2.0,3.0
杭州,视觉工程师,瑞声声学科技（深圳）有限公司,1.8-3万,南京,5-10年,硕士,电子/半导体/集成电路,24.0,3.0,4.0
杭州,计算生物学/机器学习科学家（蛋白大分子方向）,南京金斯瑞生物科技有限公司,1.3-2.5万,南京,1-3年,硕士,制药/生物工程,19.0,3.0,2.0
杭州,机器人测试工程师,南京日冲软件股份有限公司,1.1-1.5万,南京,1-3年,本科,计算机软件,13.0,2.0,2.0
杭州,AI应用开发工程师(J10596),南京康尼机电股份有限公司,18-30万/年,南京,3年,硕士,机械/设备/重工丨仪器仪表/工业自动化丨汽车研发/制造,20.0,3.0,1.0
杭州,AI基础设施工程师,南京蔚蓝智能科技有限公司,2-4万,南京,无经验,本科,人工智能丨计算机软件丨计算机硬件,30.0,2.0,1.0
杭州,智能体开发工程师(J10597),南京康尼机电股份有限公司,25-40万/年,南京,5年,硕士,机械/设备/重工丨仪器仪表/工业自动化丨汽车研发/制造,27.083333333333332,3.0,1.0
杭州,高级计算科学家（蛋白大分子方向）,南京金斯瑞生物科技有限公司,2.3-4万,南京,1-3年,博士,制药/生物工程,31.5,4.0,2.0
杭州,机器人应用开发工程师,淮安品向智能制造有限公司,1-1.5万,南京,1-3年,本科,汽车研发/制造丨新能源丨汽车零部件,12.5,2.0,2.0
杭州,AI 专员,广州莱佛士设计培训学院,9千-1万,南京,1-3年,本科,教育/培训/院校,9.5,2.0,2.0
杭州,产品工程师,南京蔚蓝智能科技有限公司,1.5-2.5万,南京,1-3年,本科,人工智能丨计算机软件丨计算机硬件,20.0,2.0,2.0
杭州,图像算法工程师,神州高铁技术股份有限公司,1.5-2万·13薪,南京,1-3年,硕士,仪器仪表/工业自动化,18.958333333333332,3.0,2.0
杭州,AI 交互工程师,南京日冲软件股份有限公司,1-1.5万,南京,1-3年,本科,计算机软件,12.5,2.0,2.0
杭州,ITIS部门负责人（南京）,中盈优创资讯科技有限公司,1.5-2.5万,南京,1-3年,本科,通信/网络设备丨计算机软件丨计算机服务,20.0,2.0,2.0
杭州,Machine Learning Engineer,桑德斯微电子器件（南京）有限公司,1.5-2.5万,南京,1-3年,硕士,电子/半导体/集成电路,20.0,3.0,2.0
杭州,算法工程师(优化算法/深度学习方向),上海微创软件股份有限公司,1.5-2.5万,南京,1-3年,硕士,外包服务,20.0,3.0,2.0
杭州,AI大模型工程师,中电变压器股份有限公司,1.5-2万,南京,1-3年,硕士,电气/电力/水利,17.5,3.0,2.0
杭州,AI算法工程师,江苏艾思飞精密零部件有限公司,1.5-3万,南京,1-3年,本科,汽车零部件,22.5,2.0,2.0
杭州,算法工程师（南京）,江苏昆仑互联新能源集团有限公司,1.7-2.5万,南京,1-3年,硕士,计算机服务丨云计算/大数据,21.0,3.0,2.0
杭州,算法工程师,南京正泽科技股份有限公司,1.5-2.5万·13薪,南京,1-3年,本科,仪器仪表/工业自动化,21.666666666666668,2.0,2.0
杭州,脑机接口算法研究工程师,南京华伟医疗设备有限公司,1.5-2.5万·13薪,南京,1-3年,硕士,医疗设备/器械,21.666666666666668,3.0,2.0
杭州,AI算法专家,中盈优创资讯科技有限公司,2-3万·14薪,南京,3-5年,硕士,通信/网络设备丨计算机软件丨计算机服务,29.166666666666668,3.0,3.0
杭州,AI医学影像与生命科学算法工程师,南京至盛为康科技有限公司,2-3.5万,南京,1-3年,硕士,制药/生物工程,27.5,3.0,2.0
杭州,高级ai算法工程师(工业大数据),朗坤智慧科技股份有限公司,2.5-4万,南京,无经验,博士,计算机软件,32.5,4.0,1.0
杭州,图像算法工程师,上海恒意得信息科技有限公司,1.5-2万,南京,1-3年,硕士,人工智能丨电子/半导体/集成电路丨计算机服务,17.5,3.0,2.0
杭州,高级算法工程师,迪盛微（江苏）装备科技有限公司,2-4万,南京,1-3年,硕士,仪器仪表/工业自动化丨机械/设备/重工,30.0,3.0,2.0
杭州,算法工程师,国药控股江苏有限公司,1.4-2万,南京,3-5年,本科,批发/零售,17.0,2.0,3.0
杭州,SLAM算法工程师,众仓机器人（南京）有限公司,2.5-4万·14薪,南京,3-5年,硕士,仪器仪表/工业自动化,37.916666666666664,3.0,3.0
杭州,AI应用工程师（技术助理）,江苏洛尧智慧通信科技有限公司,1.5-2.5万,南京,1-3年,硕士,计算机软件丨网络/信息安全丨计算机硬件,20.0,3.0,2.0
杭州,AI爬虫工程师,中电变压器股份有限公司,1-1.5万,南京,1-3年,本科,电气/电力/水利,12.5,2.0,2.0
杭州,ai研发工程师,南京捷帝科技有限公司,7-8千,南京,1-3年,本科,计算机软件,7.5,2.0,2.0
杭州,大模型算法工程师,南京阿贝斯信息科技有限公司,1.5-2.5万,南京,1-3年,硕士,计算机软件丨电气/电力/水利,20.0,3.0,2.0
杭州,算法工程师,前锦网络信息技术（上海）有限公司,3-4万,南京,3-5年,本科,人力资源服务,35.0,2.0,3.0
杭州,算法工程师,前锦网络信息技术（上海）有限公司,3-4万,南京,3-5年,本科,人力资源服务,35.0,2.0,3.0
杭州,人工智能算法工程师,南京蔚蓝智能科技有限公司,2-4万,南京,无经验,本科,人工智能丨计算机软件丨计算机硬件,30.0,2.0,1.0
杭州,AI应用工程师,南京沪江复合材料股份有限公司,8千-1.2万,南京,1-3年,本科,印刷/包装/造纸丨原材料和加工丨机械/设备/重工,10.0,2.0,2.0
杭州,ai研发工程师,南京新联电子股份有限公司,2.5-3.5万·13薪,南京,5-10年,硕士,电气/电力/水利丨新能源丨政府/公共事业,32.5,3.0,4.0
